{
  "lane_id": "phase7_1_ui_qualification",
  "policy_version": "1.0.0",
  "policy_digest": "6df22c4f6f53735ba66a62f9c8dcbc299e5f3c84daa57ba8a023680814947c4e",
  "objective": "Active Phase 7.1 max-UI Safety Check qualification",
  "base_sha": "facfd82ff814f21df010144d3a6bf8f3329da04c",
  "risk_class": "high",
  "impact_classes": [
    "UI_AFFECTING",
    "RUNTIME_AFFECTING",
    "GATE_OR_AUTHORITY_AFFECTING"
  ],
  "required_test_classes": [
    "actual_playwright",
    "automated_accessibility",
    "bounded_live_runtime_where_authorized",
    "cache_storage_service_worker",
    "cleanup",
    "console_log",
    "crash_recovery",
    "exact_version_proof",
    "false_green",
    "fault_injection",
    "final_advisor_before_acceptance_witness",
    "focus_behavior",
    "founder_signature_where_required",
    "headed_local_browser",
    "headless_exact_sha_ci",
    "independent_checker",
    "initial_neutral_state",
    "integration",
    "keyboard_only",
    "mutation_gate_fires",
    "negative",
    "network_log",
    "orphan_detection",
    "page_error_log",
    "protected_file_check",
    "reduced_motion_where_applicable",
    "resource_limits",
    "responsive_mobile",
    "rollback",
    "screenshots",
    "second_authority",
    "signature_bypass",
    "stale_state",
    "syntax_unit",
    "teardown",
    "trace",
    "unauthorized_path",
    "unit",
    "video_acceptance_critical",
    "zoom_200"
  ],
  "not_applicable": [],
  "independent_checker": true,
  "final_advisor_required": true,
  "founder_gate_required": true,
  "current_state": "MACHINE_VERIFICATION_IN_PROGRESS"
}