{
  "lane_id": "phase7_1_q_canonical_ui",
  "policy_version": "1.0.0",
  "policy_digest": "6df22c4f6f53735ba66a62f9c8dcbc299e5f3c84daa57ba8a023680814947c4e",
  "objective": "Phase 7.1-Q canonical UI + machine qualification",
  "base_sha": "bc56569aaaa5cba6ef9636d09d91abc7230e95a1",
  "risk_class": "high",
  "impact_classes": [
    "UI_AFFECTING",
    "API_AFFECTING",
    "RUNTIME_AFFECTING",
    "RECOVERY_AFFECTING",
    "SECURITY_BOUNDARY_AFFECTING",
    "GATE_OR_AUTHORITY_AFFECTING"
  ],
  "required_test_classes": [
    "actual_playwright",
    "authz_where_applicable",
    "automated_accessibility",
    "bounded_live_runtime_where_authorized",
    "bypass_attempts",
    "cache_storage_service_worker",
    "cleanup",
    "console_log",
    "contract_tests",
    "crash_recovery",
    "deny_path",
    "evidence_binding",
    "exact_version_proof",
    "false_green",
    "fault_injection",
    "final_advisor_before_acceptance_witness",
    "focus_behavior",
    "founder_signature_where_required",
    "headed_local_browser",
    "headless_exact_sha_ci",
    "idempotency_duplicate",
    "independent_adversarial_checker",
    "independent_checker",
    "initial_neutral_state",
    "integration",
    "isolation",
    "keyboard_only",
    "malformed_input",
    "mutation",
    "mutation_gate_fires",
    "negative",
    "negative_requests",
    "network_log",
    "orphan_detection",
    "page_error_log",
    "permission",
    "protected_file_check",
    "reduced_motion_where_applicable",
    "resource_limits",
    "responsive_mobile",
    "rollback",
    "schema_validation",
    "screenshots",
    "second_authority",
    "secret_scan",
    "signature_bypass",
    "stale_state",
    "syntax_unit",
    "teardown",
    "timeout_behavior",
    "trace",
    "unauthorized_path",
    "unit",
    "video_acceptance_critical",
    "zoom_200"
  ],
  "not_applicable": [],
  "independent_checker": true,
  "final_advisor_required": true,
  "founder_gate_required": true,
  "current_state": "MACHINE_VERIFICATION_IN_PROGRESS"
}